source,author,title,description,publish_date
Android Central,bradypsnyder@gmail.com (Brady Snyder),"Gemini 2.0 may have just leaked, indicating a release could be imminent","The next Google Gemini model might debut a lot sooner than we thought, if a recent leak is any indication.",2024-11-11 21:21:57
Android Central,bradypsnyder@gmail.com (Brady Snyder),Android 15 is rolling out to OnePlus Open in the U.S. next week,"OnePlus already brought OxygenOS 15 to the OnePlus 12 and OnePlus Pad, and the Open is next.",2024-11-25 18:23:46
PetaPixel,Chris Monlux,Redesigning Photography with AI-Enhanced Metalenses,"Optics and artificial intelligence have converged to create a new imaging system that could transform photography.
[Read More]",2024-11-18 18:56:06
BBC News,,'I was scammed out of £75k by Martin Lewis deepfake advert',"Des Healey lost £76,000 in a scam using a deepfake of Martin Lewis and Elon Musk.",2024-11-24 00:59:04
Business Insider,ledmonds@businessinsider.com (Lauren Edmonds),Intel says it's bringing back free office coffee to boost morale after a rough year,"Intel has struggled to stay competitive in recent years, causing it to layoff thousands of employees and slash employee perks like free coffee.",2024-11-07 20:49:19
